{
  "url": "https://github.com/KristjanESPERANTO/MMM-PublicTransportHafas",
  "name": "MMM-PublicTransportHafas",
  "description": "Public transport timetable display",
  "category": "Transportation",
  "submissionType": "New Module",
  "submittedBy": "testuser",
  "submittedAt": "2025-10-19T12:00:00Z",
  "issueNumber": 1
}
